{
  "id": "PR-0315",
  "clb": "CL-0001",
  "atributo": "processo e modo de fazer",
  "valor": "o banho-maria pasteuriza o suco dentro das garrafas tampadas, caramelizando os açúcares e dando o tom amarelado",
  "periodo": {
    "referido": "2008-2009"
  },
  "evidencias": [
    "EV-0369"
  ],
  "mu": 0.5,
  "lambda": 0.0,
  "sustenta_aviso_saude_politica": false,
  "origem_registro": {
    "criado_por": "scripts/gravar_extracao.py (gravar-extracao-0.2)",
    "data": "2026-10-29",
    "execucao": "EX-0068"
  },
  "estado": "intermediário",
  "versao_regra": "mu-lambda-0.2",
  "estado_detalhe": "quase-verdadeiro tendendo ao paracompleto"
}
