{
  "id": "PR-0419",
  "clb": "CL-0001",
  "atributo": "uso e consumo",
  "valor": "um produtor de Água Branca tem, além da aposentadoria pelo FUNRURAL, a renda da venda da cajuína",
  "periodo": {
    "referido": "2009"
  },
  "evidencias": [
    "EV-0512"
  ],
  "mu": 0.5,
  "lambda": 0.0,
  "sustenta_aviso_saude_politica": false,
  "origem_registro": {
    "criado_por": "scripts/gravar_extracao.py (gravar-extracao-0.2)",
    "data": "2026-10-29",
    "execucao": "EX-0069"
  },
  "estado": "intermediário",
  "versao_regra": "mu-lambda-0.2",
  "estado_detalhe": "quase-verdadeiro tendendo ao paracompleto"
}
