{
  "id": "PR-0256",
  "clb": "CL-0001",
  "atributo": "significados",
  "valor": "a cajuína era bebida muito fina e saborosa",
  "periodo": {
    "referido": "décadas de 1930 a 1950"
  },
  "evidencias": [
    "EV-0291"
  ],
  "mu": 0.5,
  "lambda": 0.0,
  "sustenta_aviso_saude_politica": false,
  "origem_registro": {
    "criado_por": "scripts/gravar_extracao.py (gravar-extracao-0.2)",
    "data": "2026-10-29",
    "execucao": "EX-0067"
  },
  "estado": "intermediário",
  "versao_regra": "mu-lambda-0.2",
  "estado_detalhe": "quase-verdadeiro tendendo ao paracompleto"
}
