{
  "id": "PR-0409",
  "clb": "CL-0001",
  "atributo": "uso e consumo",
  "valor": "a cajuína vira presente para os filhos da terra que retornam ao lar ou partem para estudar ou trabalhar em cidades distantes",
  "periodo": {
    "referido": "2008-2009"
  },
  "evidencias": [
    "EV-0501"
  ],
  "mu": 0.5,
  "lambda": 0.0,
  "sustenta_aviso_saude_politica": false,
  "origem_registro": {
    "criado_por": "scripts/gravar_extracao.py (gravar-extracao-0.2)",
    "data": "2026-10-29",
    "execucao": "EX-0069"
  },
  "estado": "intermediário",
  "versao_regra": "mu-lambda-0.2",
  "estado_detalhe": "quase-verdadeiro tendendo ao paracompleto"
}
