{
  "id": "PR-0039",
  "clb": "CL-0001",
  "atributo": "uso e consumo",
  "valor": "produto basicamente de consumo regional, obtido do suco clarificado",
  "periodo": {
    "referido": "não dito na fonte"
  },
  "evidencias": [
    "EV-0056"
  ],
  "mu": 0.5,
  "lambda": 0.0,
  "sustenta_aviso_saude_politica": false,
  "origem_registro": {
    "criado_por": "scripts/gravar_extracao.py (gravar-extracao-0.1)",
    "data": "2026-10-29",
    "execucao": "EX-0050"
  },
  "estado": "intermediário",
  "versao_regra": "mu-lambda-0.2",
  "estado_detalhe": "quase-verdadeiro tendendo ao paracompleto"
}
